{
  "schema_version": "0.1.0",
  "kind": "space",
  "space_id": "mingos-project",
  "space_type": "team",
  "name": "MingOS 自举项目空间",
  "owner_actor_id": "human-yueming",
  "member_actor_ids": [
    "agent-bootstrap",
    "agent-continuity"
  ],
  "purpose": "用 MingOS 协议持续建设并验证 MingOS 本身",
  "lifecycle": "active",
  "boundaries": [
    "不把 Family-Space 的家庭业务写入通用内核",
    "没有证据不得标记完成",
    "重大方向和不可逆操作保留给人决定"
  ],
  "foundation_repository": "YuemingHub/mingos-foundation",
  "domain_repository": "YuemingHub/MingOS",
  "created_at": "2026-08-06T09:42:00Z",
  "updated_at": "2026-08-06T12:40:00Z"
}
